<Defs xmlns:xsi="http://www.w3.org/2001/XMLSchema-instance" xsi:noNamespaceSchemaLocation="../../../Schemas/ThoughtDef.xsd">
    <ThoughtDef ParentName="OutlookMemoryBase">
		<defName>ChickenTransformationMemory</defName>
        <stages>
            <li>
                <label>morphed</label>
                <description>I'm... covered in feathers... OUCH! What!? Did I just lay an *egg*! Oh no...</description>
                <baseMoodEffect>-3</baseMoodEffect>
            </li>
            <li>
              <label>morphed</label>
                <description>I'm all feathery, and these wings are nea- BWAK! What the- An egg! Neat!</description>
                <baseMoodEffect>+3</baseMoodEffect>
            </li>
            <li>
              <label>morphed</label>
                <description>Oh man, these feathers are disgusting, and the talons look fr- BWAK! What the â€” oh no... please tell me that's not an egg...</description>
                <baseMoodEffect>-5</baseMoodEffect>
            </li>
            <li>
              <label>morphed</label>
                <description>These feathers and talons are so good, and laying eggs! If only I could just settle down in a nesting box.</description>
                <baseMoodEffect>+1</baseMoodEffect>
            </li>
        </stages>
    </ThoughtDef>

    <ThoughtDef ParentName="OutlookMemoryBase">
		<defName>ChickenRevertedMemory</defName>
        <stages>
            <li>
                <label>reverted</label>
                <description>I'm back to my normal, human self again! No more laying eggs. Or eating eggs, please.</description>
                <baseMoodEffect>3</baseMoodEffect>
            </li>
            <li>
                <label>reverted</label>
                <description>But the feathers! The *eggs*! Didn't you like the breakfast I made?</description>
                <baseMoodEffect>-3</baseMoodEffect>
            </li>
            <li>
                <label>reverted</label>
                <description>Hands and feet. And most important, no more eggs. EVER.</description>
                <baseMoodEffect>10</baseMoodEffect>
            </li>
            <li>
                <label>reverted</label>
                <description>I'm human again? I think I wanted the opposite of this.</description>
                <baseMoodEffect>-5</baseMoodEffect>
            </li>
        </stages>
    </ThoughtDef>

	<ThoughtDef ParentName="OutlookMemoryBase">
		<durationDays>1</durationDays>
		<defName>EtherTailfeathers</defName>
		<stages>
			<li>
				<label>Tailfeathers</label>
				<description>...does this make my butt look big?</description>
				<visible>true</visible>
				<baseMoodEffect>-1</baseMoodEffect>
			</li>
			<li>
				<label>Tailfeathers</label>
				<description>It's kind of fun to wiggle it.</description>
				<visible>true</visible>
				<baseMoodEffect>1</baseMoodEffect>
			</li>
			<li>
				<label>Tailfeathers</label>
				<description>I look like a damn chicken, whyyyy?!</description>
				<visible>true</visible>
				<baseMoodEffect>-2</baseMoodEffect>
			</li>
		</stages>
	</ThoughtDef>

	<ThoughtDef ParentName="OutlookMemoryBase">
		<durationDays>1</durationDays>
		<defName>EtherEggLayer</defName>
		<stages>
			<li>
				<label>...eggs?!</label>
				<description>How is this even possible? It feels so weird...</description>
				<visible>true</visible>
				<baseMoodEffect>-5</baseMoodEffect>
			</li>
			<li>
				<label>...eggs?!</label>
				<description>This is taking it too far. People weren't meant to lay eggs!</description>
				<visible>true</visible>
				<baseMoodEffect>-3</baseMoodEffect>
			</li>
			<li>
				<label>...eggs?!</label>
				<description>How!? Why!? What has become of me!?</description>
				<visible>true</visible>
				<baseMoodEffect>-10</baseMoodEffect>
			</li>
			<li>
				<label>...eggs?!</label>
				<description>I know I wanted this, but I'm not entirely sure now.</description>
				<visible>true</visible>
				<baseMoodEffect>0</baseMoodEffect>
			</li>
		</stages>
	</ThoughtDef>

	<ThoughtDef ParentName="OutlookMemoryBase">
		<durationDays>1</durationDays>
		<defName>EtherBeak</defName>
		<stages>
			<li>
				<label>Beak</label>
				<description>I can't talk properly with this stupid beak!</description>
				<visible>true</visible>
				<baseMoodEffect>-1</baseMoodEffect>
			</li>
			<li>
				<label>Beak</label>
				<description>Time to peck everyone I don't like.</description>
				<visible>true</visible>
				<baseMoodEffect>2</baseMoodEffect>
			</li>
			<li>
				<label>Beak</label>
				<description>My face! This is awf-bawk!</description>
				<visible>true</visible>
				<baseMoodEffect>-3</baseMoodEffect>
			</li>
		</stages>
	</ThoughtDef>
	
</Defs>
