<Defs xmlns:xsi="http://www.w3.org/2001/XMLSchema-instance" xsi:noNamespaceSchemaLocation="../../../Schemas/ThoughtDef.xsd">
    <ThoughtDef ParentName="OutlookMemoryBase">
		<defName>MonkeyTransformationMemory</defName>
        <stages>
            <li>
                <label>!!!MonkeyTransformationMemory's default stage needs a label!!!</label>
                <description>!!!MonkeyTransformationMemory's default stage needs a description!!!</description>
                <baseMoodEffect>-3</baseMoodEffect>
            </li>
            <li>
                <label>!!!MonkeyTransformationMemory's mutation affinity stage needs a label!!!</label>
                <description>!!!MonkeyTransformationMemory's mutation affinity stage needs a description!!!</description>
                <baseMoodEffect>+3</baseMoodEffect>
            </li>
            <li>
                <label>!!!MonkeyTransformationMemory's body purist stage needs a label!!!</label>
                <description>!!!MonkeyTransformationMemory's body purist stage needs a description!!!</description>
                <baseMoodEffect>-5</baseMoodEffect>
            </li>
            <li>
                <label>!!!MonkeyTransformationMemory's primal wish stage needs a label!!!</label>
                <description>!!!MonkeyTransformationMemory's primal wish stage needs a description!!!</description>
                <baseMoodEffect>+1</baseMoodEffect>
            </li>
        </stages>
    </ThoughtDef>
	
    <ThoughtDef ParentName="OutlookMemoryBase">
		<defName>MonkeyRevertedMemory</defName>
        <stages>
            <li>
                <label>!!!MonkeyRevertedMemory's default stage needs a label!!!</label>
                <description>!!!MonkeyRevertedMemory's default stage needs a description!!!</description>
                <baseMoodEffect>-3</baseMoodEffect>
            </li>
            <li>
                <label>!!!MonkeyRevertedMemory's mutation affinity stage needs a label!!!</label>
                <description>!!!MonkeyRevertedMemory's mutation affinity stage needs a description!!!</description>
                <baseMoodEffect>+3</baseMoodEffect>
            </li>
            <li>
                <label>!!!MonkeyRevertedMemory's body purist stage needs a label!!!</label>
                <description>!!!MonkeyRevertedMemory's body purist stage needs a description!!!</description>
                <baseMoodEffect>-5</baseMoodEffect>
            </li>
            <li>
                <label>!!!MonkeyRevertedMemory's primal wish stage needs a label!!!</label>
                <description>!!!MonkeyRevertedMemory's primal wish stage needs a description!!!</description>
                <baseMoodEffect>+1</baseMoodEffect>
            </li>
        </stages>
    </ThoughtDef>
</Defs>