<Defs xmlns:xsi="http://www.w3.org/2001/XMLSchema-instance" xsi:noNamespaceSchemaLocation="../../../Schemas/ThoughtDef.xsd">
    <ThoughtDef ParentName="OutlookMemoryBase">
		<defName>BoomratTransformationMemory</defName>
        <stages>
            <li>
                <label>!!!BoomratTransformationMemory's default stage needs a label!!!</label>
                <description>!!!BoomratTransformationMemory's default stage needs a description!!!</description>
                <baseMoodEffect>-3</baseMoodEffect>
            </li>
            <li>
                <label>!!!BoomratTransformationMemory's mutation affinity stage needs a label!!!</label>
                <description>!!!BoomratTransformationMemory's mutation affinity stage needs a description!!!</description>
                <baseMoodEffect>+3</baseMoodEffect>
            </li>
            <li>
                <label>!!!BoomratTransformationMemory's body purist stage needs a label!!!</label>
                <description>!!!BoomratTransformationMemory's body purist stage needs a description!!!</description>
                <baseMoodEffect>-5</baseMoodEffect>
            </li>
            <li>
                <label>!!!BoomratTransformationMemory's primal wish stage needs a label!!!</label>
                <description>!!!BoomratTransformationMemory's primal wish stage needs a description!!!</description>
                <baseMoodEffect>+1</baseMoodEffect>
            </li>
        </stages>
    </ThoughtDef>
	
    <ThoughtDef ParentName="OutlookMemoryBase">
		<defName>BoomratRevertedMemory</defName>
        <stages>
            <li>
                <label>!!!BoomratRevertedMemory's default stage needs a label!!!</label>
                <description>!!!BoomratRevertedMemory's default stage needs a description!!!</description>
                <baseMoodEffect>-3</baseMoodEffect>
            </li>
            <li>
                <label>!!!BoomratRevertedMemory's mutation affinity stage needs a label!!!</label>
                <description>!!!BoomratRevertedMemory's mutation affinity stage needs a description!!!</description>
                <baseMoodEffect>+3</baseMoodEffect>
            </li>
            <li>
                <label>!!!BoomratRevertedMemory's body purist stage needs a label!!!</label>
                <description>!!!BoomratRevertedMemory's body purist stage needs a description!!!</description>
                <baseMoodEffect>-5</baseMoodEffect>
            </li>
            <li>
                <label>!!!BoomratRevertedMemory's primal wish stage needs a label!!!</label>
                <description>!!!BoomratRevertedMemory's primal wish stage needs a description!!!</description>
                <baseMoodEffect>+1</baseMoodEffect>
            </li>
        </stages>
    </ThoughtDef>
</Defs>