<Defs xmlns:xsi="http://www.w3.org/2001/XMLSchema-instance" xsi:noNamespaceSchemaLocation="../../../Schemas/ThoughtDef.xsd">
    <ThoughtDef ParentName="OutlookMemoryBase">
		<defName>SquirrelTransformationMemory</defName>
        <stages>
            <li>
                <label>!!!SquirrelTransformationMemory's default stage needs a label!!!</label>
                <description>!!!SquirrelTransformationMemory's default stage needs a description!!!</description>
                <baseMoodEffect>-3</baseMoodEffect>
            </li>
            <li>
                <label>!!!SquirrelTransformationMemory's mutation affinity stage needs a label!!!</label>
                <description>!!!SquirrelTransformationMemory's mutation affinity stage needs a description!!!</description>
                <baseMoodEffect>+3</baseMoodEffect>
            </li>
            <li>
                <label>!!!SquirrelTransformationMemory's body purist stage needs a label!!!</label>
                <description>!!!SquirrelTransformationMemory's body purist stage needs a description!!!</description>
                <baseMoodEffect>-5</baseMoodEffect>
            </li>
            <li>
                <label>!!!SquirrelTransformationMemory's primal wish stage needs a label!!!</label>
                <description>!!!SquirrelTransformationMemory's primal wish stage needs a description!!!</description>
                <baseMoodEffect>+1</baseMoodEffect>
            </li>
        </stages>
    </ThoughtDef>
	
    <ThoughtDef ParentName="OutlookMemoryBase">
		<defName>SquirrelRevertedMemory</defName>
        <stages>
            <li>
                <label>!!!SquirrelRevertedMemory's default stage needs a label!!!</label>
                <description>!!!SquirrelRevertedMemory's default stage needs a description!!!</description>
                <baseMoodEffect>-3</baseMoodEffect>
            </li>
            <li>
                <label>!!!SquirrelRevertedMemory's mutation affinity stage needs a label!!!</label>
                <description>!!!SquirrelRevertedMemory's mutation affinity stage needs a description!!!</description>
                <baseMoodEffect>+3</baseMoodEffect>
            </li>
            <li>
                <label>!!!SquirrelRevertedMemory's body purist stage needs a label!!!</label>
                <description>!!!SquirrelRevertedMemory's body purist stage needs a description!!!</description>
                <baseMoodEffect>-5</baseMoodEffect>
            </li>
            <li>
                <label>!!!SquirrelRevertedMemory's primal wish stage needs a label!!!</label>
                <description>!!!SquirrelRevertedMemory's primal wish stage needs a description!!!</description>
                <baseMoodEffect>+1</baseMoodEffect>
            </li>
        </stages>
    </ThoughtDef>
</Defs>