<Defs xmlns:xsi="http://www.w3.org/2001/XMLSchema-instance" xsi:noNamespaceSchemaLocation="../../../Schemas/ThoughtDef.xsd">
    <ThoughtDef ParentName="OutlookMemoryBase">
		<defName>CobraTransformationMemory</defName>
        <stages>
            <li>
                <label>!!!CobraTransformationMemory's default stage needs a label!!!</label>
                <description>!!!CobraTransformationMemory's default stage needs a description!!!</description>
                <baseMoodEffect>-3</baseMoodEffect>
            </li>
            <li>
                <label>!!!CobraTransformationMemory's mutation affinity stage needs a label!!!</label>
                <description>!!!CobraTransformationMemory's mutation affinity stage needs a description!!!</description>
                <baseMoodEffect>+3</baseMoodEffect>
            </li>
            <li>
                <label>!!!CobraTransformationMemory's body purist stage needs a label!!!</label>
                <description>!!!CobraTransformationMemory's body purist stage needs a description!!!</description>
                <baseMoodEffect>-5</baseMoodEffect>
            </li>
            <li>
                <label>!!!CobraTransformationMemory's primal wish stage needs a label!!!</label>
                <description>!!!CobraTransformationMemory's primal wish stage needs a description!!!</description>
                <baseMoodEffect>+1</baseMoodEffect>
            </li>
        </stages>
    </ThoughtDef>
	
    <ThoughtDef ParentName="OutlookMemoryBase">
		<defName>CobraRevertedMemory</defName>
        <stages>
            <li>
                <label>!!!CobraRevertedMemory's default stage needs a label!!!</label>
                <description>!!!CobraRevertedMemory's default stage needs a description!!!</description>
                <baseMoodEffect>-3</baseMoodEffect>
            </li>
            <li>
                <label>!!!CobraRevertedMemory's mutation affinity stage needs a label!!!</label>
                <description>!!!CobraRevertedMemory's mutation affinity stage needs a description!!!</description>
                <baseMoodEffect>+3</baseMoodEffect>
            </li>
            <li>
                <label>!!!CobraRevertedMemory's body purist stage needs a label!!!</label>
                <description>!!!CobraRevertedMemory's body purist stage needs a description!!!</description>
                <baseMoodEffect>-5</baseMoodEffect>
            </li>
            <li>
                <label>!!!CobraRevertedMemory's primal wish stage needs a label!!!</label>
                <description>!!!CobraRevertedMemory's primal wish stage needs a description!!!</description>
                <baseMoodEffect>+1</baseMoodEffect>
            </li>
        </stages>
    </ThoughtDef>
</Defs>