<Defs xmlns:xsi="http://www.w3.org/2001/XMLSchema-instance" xsi:noNamespaceSchemaLocation="../../../Schemas/ThoughtDef.xsd">

	<ThoughtDef ParentName="OutlookMemoryBase">
		<durationDays>1</durationDays>
		<defName>EtherArcticFoxMuzzle</defName>
		<stages>
			<li>
				<label>Fox face</label>
				<description>I just licked my nose...eww.</description>
				<visible>true</visible>
				<baseMoodEffect>-1</baseMoodEffect>
			</li>
			<li>
				<label>Fox face</label>
				<description>Oh, so that's how foxes make all those cool noises! Yip!</description>
				<visible>true</visible>
				<baseMoodEffect>2</baseMoodEffect>
			</li>
			<li>
				<label>Fox face</label>
				<description>My face is ruined, and I can't even talk right!</description>
				<visible>true</visible>
				<baseMoodEffect>-3</baseMoodEffect>
			</li>
		</stages>
	</ThoughtDef>
	
	<ThoughtDef ParentName="OutlookMemoryBase">
		<durationDays>1</durationDays>
		<defName>EtherArcticFoxEar</defName>
		<stages>
			<li>
				<label>Fox ears</label>
				<description>Okay, I'll admit it, these are pretty cool.</description>
				<visible>true</visible>
				<baseMoodEffect>1</baseMoodEffect>
			</li>
			<li>
				<label>Fox ears</label>
				<description>Pointy and fluffy ears, these are great â€” and I can hear everything!</description>
				<visible>true</visible>
				<baseMoodEffect>2</baseMoodEffect>
			</li>
			<li>
				<label>Fox ears</label>
				<description>...if there's one awful mutation I'm OK with...</description>
				<visible>true</visible>
				<baseMoodEffect>0</baseMoodEffect>
			</li>
		</stages>
	</ThoughtDef>
	
	<ThoughtDef ParentName="OutlookMemoryBase">
		<durationDays>1</durationDays>
		<defName>EtherArcticFluffyTail</defName>
		<stages>
			<li>
				<label>Fluffy tail</label>
				<description>It gets in the way, but it's really fluffy...I could almost use it as a pillow.</description>
				<visible>true</visible>
				<baseMoodEffect>1</baseMoodEffect>
			</li>
			<li>
				<label>Fluffy tail</label>
				<description>It's so fluffy I think I'm gonna die!</description>
				<visible>true</visible>
				<baseMoodEffect>2</baseMoodEffect>
			</li>
			<li>
				<label>Fluffy tail</label>
				<description>Sure it's cute...but it's attached to me!</description>
				<visible>true</visible>
				<baseMoodEffect>-2</baseMoodEffect>
			</li>
		</stages>
	</ThoughtDef>
	
</Defs>
