<Defs xmlns:xsi="http://www.w3.org/2001/XMLSchema-instance" xsi:noNamespaceSchemaLocation="../../../Schemas/ThoughtDef.xsd">
    <ThoughtDef ParentName="OutlookMemoryBase">
        <defName>CaribouTransformationMemory</defName>
        <stages>
            <li>
                <label>TODO</label>
                <description>TODO</description>
                <baseMoodEffect>-3</baseMoodEffect>
            </li>
            <li>
                <label>TODO</label>
                <description>TODO</description>
                <baseMoodEffect>+3</baseMoodEffect>
            </li>
            <li>
                <label>TODO</label>
                <description>TODO</description>
                <baseMoodEffect>-5</baseMoodEffect>
            </li>
            <li>
                <label>TODO</label>
                <description>TODO</description>
                <baseMoodEffect>+1</baseMoodEffect>
            </li>
        </stages>
    </ThoughtDef>

    <ThoughtDef ParentName="OutlookMemoryBase">
        <defName>CaribouRevertedMemory</defName>
        <stages>
            <li>
                <label>TODO</label>
                <description>TODO</description>
                <baseMoodEffect>-3</baseMoodEffect>
            </li>
            <li>
                <label>TODO</label>
                <description>TODO</description>
                <baseMoodEffect>+3</baseMoodEffect>
            </li>
            <li>
                <label>TODO</label>
                <description>TODO</description>
                <baseMoodEffect>+10</baseMoodEffect>
            </li>
            <li>
                <label>TODO</label>
                <description>TODO</description>
                <baseMoodEffect>-5</baseMoodEffect>
            </li>
        </stages>
    </ThoughtDef>

    <ThoughtDef ParentName="OutlookMemoryBase">
        <durationDays>1</durationDays>
        <defName>EtherCaribouEar</defName>
        <stages>
            <li>
                <label>Reindeer ears</label>
                <description>At least they keep the flies off themselves...?</description>
                <visible>True</visible>
                <baseMoodEffect>-1</baseMoodEffect>
            </li>
            <li>
                <label>Reindeer ears</label>
                <description>I can hear everything!</description>
                <visible>True</visible>
                <baseMoodEffect>1</baseMoodEffect>
            </li>
            <li>
                <label>Reindeer ears</label>
                <description>These things are so twitchy, get them off me!</description>
                <visible>True</visible>
                <baseMoodEffect>-2</baseMoodEffect>
            </li>
        </stages>
    </ThoughtDef>


    <ThoughtDef ParentName="OutlookMemoryBase">
        <durationDays>1</durationDays>
        <defName>EtherCaribouTail</defName>
        <stages>
            <li>
                <label>Short tail</label>
                <description>Is this thing... a tail?</description>
                <visible>True</visible>
                <baseMoodEffect>-1</baseMoodEffect>
            </li>
            <li>
                <label>Short tail</label>
                <description>It's so fluffy!</description>
                <visible>True</visible>
                <baseMoodEffect>1</baseMoodEffect>
            </li>
            <li>
                <label>Short tail</label>
                <description>Just big enough to be hard to hide... great...</description>
                <visible>True</visible>
                <baseMoodEffect>-2</baseMoodEffect>
            </li>
        </stages>
    </ThoughtDef>
</Defs>